{"$schema":"https://json-schema.org/draft/2020-12/schema","$id":"https://tiber-data.local/contracts/season-intelligence-event.v1.schema.json","title":"Season Intelligence Event v1","type":"object","additionalProperties":false,"required":["event_id","schema_version","season","week","known_at","subject","event_type","fact_status","summary","mechanisms","sources","confidence_tier","fantasy_impact","model_treatment","next_required_evidence","recheck_after"],"properties":{"event_id":{"type":"string","pattern":"^sie-[0-9]{4}-w[0-9]{2}-[a-z0-9-]+$"},"schema_version":{"const":"season-intelligence-event.v1"},"season":{"type":"integer","minimum":1900},"week":{"type":"integer","minimum":1,"maximum":22},"occurred_at":{"type":["string","null"],"format":"date-time"},"known_at":{"type":"string","format":"date-time"},"subject":{"type":"object","additionalProperties":false,"required":["entity_type","display_name","team"],"properties":{"entity_type":{"enum":["player","team","position_group","coach","game","league"]},"display_name":{"type":"string","minLength":1},"team":{"type":["string","null"],"minLength":2},"canonical_id":{"type":["string","null"]}}},"event_type":{"enum":["injury","readiness","role","usage","depth_chart","scheme","performance_context","transaction","contract","discipline","team_context"]},"fact_status":{"enum":["CONFIRMED","REPORTED","OBSERVED","SPECULATIVE"]},"summary":{"type":"string","minLength":1},"mechanisms":{"type":"array","minItems":1,"uniqueItems":true,"items":{"enum":["snap_share","route_share","target_share","carry_share","goal_line_role","personnel","qb_change","injury_recurring","protection","coaching","availability","volume","turnover_context","replacement_competence","defensive_matchup","other"]}},"sources":{"type":"array","minItems":1,"items":{"type":"object","additionalProperties":false,"required":["source_name","source_role","url","published_at","retrieved_at","quality"],"properties":{"source_name":{"type":"string","minLength":1},"source_role":{"enum":["league","team","wire","primary_media","specialist_analysis","community_analysis"]},"url":{"type":"string","format":"uri"},"published_at":{"type":["string","null"],"format":"date-time"},"retrieved_at":{"type":"string","format":"date-time"},"quality":{"enum":["HIGH","MEDIUM","LOW"]}}}},"confidence_tier":{"enum":["HIGH","MEDIUM","LOW"],"description":"Ordinal evidence-confidence tier derived from provenance and corroboration; not a probability."},"fantasy_impact":{"type":"object","additionalProperties":false,"required":["direction","magnitude","time_horizon","uncertainty","role_fragility","affected_entities"],"properties":{"direction":{"enum":["UP","DOWN","MIXED","NEUTRAL"]},"magnitude":{"enum":["LOW","MEDIUM","HIGH","CRITICAL"]},"time_horizon":{"enum":["NEXT_WEEK","SHORT_TERM","REST_OF_SEASON","MULTI_YEAR","UNKNOWN"]},"uncertainty":{"enum":["LOW","MEDIUM","HIGH"]},"role_fragility":{"enum":["LOW","MEDIUM","HIGH","NOT_APPLICABLE"]},"affected_entities":{"type":"array","items":{"type":"string","minLength":1}}}},"model_treatment":{"enum":["IMMEDIATE_UPDATE","PARTIAL_UPDATE","WATCH_ONLY","CONTEXT_ONLY","NO_MODEL_WEIGHT"]},"next_required_evidence":{"type":"array","items":{"type":"string","minLength":1}},"recheck_after":{"type":["string","null"],"format":"date-time"},"supersedes_event_id":{"type":["string","null"]},"notes":{"type":"array","items":{"type":"string","minLength":1}}}}
