[{"event_id":"sie-2026-w01-minnesota-rb-functional-split","schema_version":"season-intelligence-event.v1","season":2026,"week":1,"occurred_at":null,"known_at":"2026-09-14T09:37:00-04:00","subject":{"entity_type":"position_group","display_name":"Minnesota backfield","team":"MIN","canonical_id":null},"event_type":"role","fact_status":"OBSERVED","summary":"Jordan Mason led early-down rushing while Aaron Jones retained the preferred passing-down role.","mechanisms":["carry_share","route_share"],"sources":[{"source_name":"PFF","source_role":"specialist_analysis","url":"https://www.pff.com/news/fantasy-football-week-1-recap","published_at":null,"retrieved_at":"2026-09-14T09:37:00-04:00","quality":"MEDIUM"}],"confidence_tier":"MEDIUM","fantasy_impact":{"direction":"MIXED","magnitude":"MEDIUM","time_horizon":"REST_OF_SEASON","uncertainty":"MEDIUM","role_fragility":"MEDIUM","affected_entities":["Jordan Mason","Aaron Jones"]},"model_treatment":"PARTIAL_UPDATE","next_required_evidence":["Week 2 early-down/third-down shares","Goal-line work"],"recheck_after":"2026-09-20T17:00:00-04:00","supersedes_event_id":null,"notes":[]},{"event_id":"sie-2026-w01-heavy-personnel-trend","schema_version":"season-intelligence-event.v1","season":2026,"week":1,"occurred_at":null,"known_at":"2026-09-14T09:37:00-04:00","subject":{"entity_type":"position_group","display_name":"NFL personnel trend","team":null,"canonical_id":null},"event_type":"team_context","fact_status":"OBSERVED","summary":"Week 1 reinforced the multi-year shift toward heavier personnel, increasing the importance of formation-adjusted route opportunity.","mechanisms":["personnel"],"sources":[{"source_name":"PFF","source_role":"specialist_analysis","url":"https://www.pff.com/news/fantasy-football-nfl-personnel-trends-how-heavier-groupings-are-shrinking-the-fantasy-flex-pool","published_at":null,"retrieved_at":"2026-09-14T09:37:00-04:00","quality":"MEDIUM"}],"confidence_tier":"MEDIUM","fantasy_impact":{"direction":"NEUTRAL","magnitude":"MEDIUM","time_horizon":"REST_OF_SEASON","uncertainty":"MEDIUM","role_fragility":"NOT_APPLICABLE","affected_entities":["TEs","WR3/flex pool"]},"model_treatment":"CONTEXT_ONLY","next_required_evidence":["League-wide Week 2 personnel rates","Team-specific persistence"],"recheck_after":"2026-09-22T12:00:00-04:00","supersedes_event_id":null,"notes":[]},{"event_id":"sie-2026-w01-walker-kc-lead-back","schema_version":"season-intelligence-event.v1","season":2026,"week":1,"occurred_at":null,"known_at":"2026-09-15T06:48:00-04:00","subject":{"entity_type":"player","display_name":"Kenneth Walker III","team":"KC","canonical_id":null},"event_type":"role","fact_status":"OBSERVED","summary":"Walker started and handled 23 carries for 173 yards, with early competitive usage supporting a clear lead-back role over Emmett Johnson.","mechanisms":["carry_share","snap_share","goal_line_role"],"sources":[{"source_name":"PFF","source_role":"specialist_analysis","url":"https://www.pff.com/news/fantasy-football-broncos-recap-chiefs-week-1","published_at":null,"retrieved_at":"2026-09-15T06:48:00-04:00","quality":"MEDIUM"},{"source_name":"Reuters","source_role":"wire","url":"https://www.reuters.com/sports/nfl/kenneth-walker-iii-delivers-kc-masterpiece-chiefs-blast-broncos-31-10--flm-2026-09-15/","published_at":null,"retrieved_at":"2026-09-15T06:48:00-04:00","quality":"HIGH"}],"confidence_tier":"HIGH","fantasy_impact":{"direction":"UP","magnitude":"CRITICAL","time_horizon":"REST_OF_SEASON","uncertainty":"LOW","role_fragility":"LOW","affected_entities":["Kenneth Walker III","Emmett Johnson"]},"model_treatment":"IMMEDIATE_UPDATE","next_required_evidence":["Week 2 snap/route/goal-line shares"],"recheck_after":"2026-09-20T23:59:00-04:00","supersedes_event_id":null,"notes":["Regress 7.5 YPC; update role much more than efficiency."]},{"event_id":"sie-2026-w01-kc-run-heavy-opener","schema_version":"season-intelligence-event.v1","season":2026,"week":1,"occurred_at":null,"known_at":"2026-09-15T06:48:00-04:00","subject":{"entity_type":"team","display_name":"Kansas City offense","team":"KC","canonical_id":null},"event_type":"scheme","fact_status":"OBSERVED","summary":"Kansas City ran 38 times against 27 Mahomes pass attempts, a materially run-heavier opener that may reflect the Bieniemy plan, game state, or Mahomes return management.","mechanisms":["volume","coaching"],"sources":[{"source_name":"Reuters","source_role":"wire","url":"https://www.reuters.com/sports/nfl/kenneth-walker-iii-delivers-kc-masterpiece-chiefs-blast-broncos-31-10--flm-2026-09-15/","published_at":null,"retrieved_at":"2026-09-15T06:48:00-04:00","quality":"HIGH"}],"confidence_tier":"HIGH","fantasy_impact":{"direction":"MIXED","magnitude":"MEDIUM","time_horizon":"REST_OF_SEASON","uncertainty":"HIGH","role_fragility":"NOT_APPLICABLE","affected_entities":["Patrick Mahomes","KC RBs","KC pass catchers"]},"model_treatment":"WATCH_ONLY","next_required_evidence":["Weeks 2-3 neutral-script pass rate","Early-down pass rate over expectation"],"recheck_after":"2026-09-27T23:59:00-04:00","supersedes_event_id":null,"notes":[]},{"event_id":"sie-2026-w01-mahomes-knee-readiness","schema_version":"season-intelligence-event.v1","season":2026,"week":1,"occurred_at":null,"known_at":"2026-09-15T06:48:00-04:00","subject":{"entity_type":"player","display_name":"Patrick Mahomes","team":"KC","canonical_id":null},"event_type":"readiness","fact_status":"OBSERVED","summary":"Mahomes returned from ACL/LCL injury and used functional mobility, including a 15-yard rushing TD, materially reducing immediate knee-readiness uncertainty.","mechanisms":["availability","other"],"sources":[{"source_name":"KMBC","source_role":"primary_media","url":"https://www.kmbc.com/article/patrick-mahomes-postgame-press-conference-chiefs-broncos-2026/73734491","published_at":null,"retrieved_at":"2026-09-15T06:48:00-04:00","quality":"MEDIUM"},{"source_name":"Reuters","source_role":"wire","url":"https://www.reuters.com/sports/nfl/kenneth-walker-iii-delivers-kc-masterpiece-chiefs-blast-broncos-31-10--flm-2026-09-15/","published_at":null,"retrieved_at":"2026-09-15T06:48:00-04:00","quality":"HIGH"}],"confidence_tier":"HIGH","fantasy_impact":{"direction":"UP","magnitude":"HIGH","time_horizon":"REST_OF_SEASON","uncertainty":"MEDIUM","role_fragility":"NOT_APPLICABLE","affected_entities":["Patrick Mahomes","KC offense"]},"model_treatment":"PARTIAL_UPDATE","next_required_evidence":["Week 2 designed rush/scramble usage","Any postgame swelling/practice limitation"],"recheck_after":"2026-09-17T12:00:00-04:00","supersedes_event_id":null,"notes":[]},{"event_id":"sie-2026-w01-rice-target-rate-yellow-flag","schema_version":"season-intelligence-event.v1","season":2026,"week":1,"occurred_at":null,"known_at":"2026-09-15T06:48:00-04:00","subject":{"entity_type":"player","display_name":"Rashee Rice","team":"KC","canonical_id":null},"event_type":"usage","fact_status":"OBSERVED","summary":"Rice remained structurally involved but drew only two targets; the target-per-route collapse is a Week 2 recheck signal rather than a permanent downgrade after a run-heavy game.","mechanisms":["route_share","target_share","volume"],"sources":[{"source_name":"PFF","source_role":"specialist_analysis","url":"https://www.pff.com/news/fantasy-football-broncos-recap-chiefs-week-1","published_at":null,"retrieved_at":"2026-09-15T06:48:00-04:00","quality":"MEDIUM"}],"confidence_tier":"MEDIUM","fantasy_impact":{"direction":"DOWN","magnitude":"MEDIUM","time_horizon":"NEXT_WEEK","uncertainty":"HIGH","role_fragility":"MEDIUM","affected_entities":["Rashee Rice"]},"model_treatment":"WATCH_ONLY","next_required_evidence":["Week 2 route participation","First-read share","Targets per route"],"recheck_after":"2026-09-20T23:59:00-04:00","supersedes_event_id":null,"notes":[]}]
