[{"event_id":"sie-2026-w01-denver-rb-split","schema_version":"season-intelligence-event.v1","season":2026,"week":1,"occurred_at":null,"known_at":"2026-09-15T06:48:00-04:00","subject":{"entity_type":"position_group","display_name":"Denver backfield","team":"DEN","canonical_id":null},"event_type":"role","fact_status":"OBSERVED","summary":"Dobbins led early downs while Harvey handled backup work plus primary third-down/two-minute responsibilities and some short-yardage work.","mechanisms":["carry_share","route_share","goal_line_role"],"sources":[{"source_name":"PFF","source_role":"specialist_analysis","url":"https://www.pff.com/news/fantasy-football-broncos-recap-chiefs-week-1","published_at":null,"retrieved_at":"2026-09-15T06:48:00-04:00","quality":"MEDIUM"}],"confidence_tier":"MEDIUM","fantasy_impact":{"direction":"MIXED","magnitude":"HIGH","time_horizon":"REST_OF_SEASON","uncertainty":"MEDIUM","role_fragility":"MEDIUM","affected_entities":["J.K. Dobbins","RJ Harvey","Jonah Coleman"]},"model_treatment":"PARTIAL_UPDATE","next_required_evidence":["Week 2 third-down/two-minute shares","Goal-line allocation"],"recheck_after":"2026-09-20T20:00:00-04:00","supersedes_event_id":null,"notes":[]},{"event_id":"sie-2026-w01-pat-bryant-role-rise","schema_version":"season-intelligence-event.v1","season":2026,"week":1,"occurred_at":null,"known_at":"2026-09-15T06:48:00-04:00","subject":{"entity_type":"player","display_name":"Pat Bryant","team":"DEN","canonical_id":null},"event_type":"role","fact_status":"OBSERVED","summary":"Bryant operated frequently as the Z with Jaylen Waddle in the slot and produced 4-42, supporting a legitimate secondary-receiver role rather than a fluke box score.","mechanisms":["snap_share","route_share"],"sources":[{"source_name":"PFF","source_role":"specialist_analysis","url":"https://www.pff.com/news/fantasy-football-broncos-recap-chiefs-week-1","published_at":null,"retrieved_at":"2026-09-15T06:48:00-04:00","quality":"MEDIUM"}],"confidence_tier":"MEDIUM","fantasy_impact":{"direction":"UP","magnitude":"MEDIUM","time_horizon":"REST_OF_SEASON","uncertainty":"MEDIUM","role_fragility":"MEDIUM","affected_entities":["Pat Bryant","Marvin Mims Jr.","Troy Franklin"]},"model_treatment":"PARTIAL_UPDATE","next_required_evidence":["Week 2 routes after Mims status resolves"],"recheck_after":"2026-09-20T20:00:00-04:00","supersedes_event_id":null,"notes":[]},{"event_id":"sie-2026-w01-engram-role-expansion","schema_version":"season-intelligence-event.v1","season":2026,"week":1,"occurred_at":null,"known_at":"2026-09-15T06:48:00-04:00","subject":{"entity_type":"player","display_name":"Evan Engram","team":"DEN","canonical_id":null},"event_type":"usage","fact_status":"OBSERVED","summary":"Engram's deployment expanded across 11 and 12 personnel with stronger route access, making the 4-43-1 result more role-supported than touchdown-only.","mechanisms":["route_share","personnel"],"sources":[{"source_name":"PFF","source_role":"specialist_analysis","url":"https://www.pff.com/news/fantasy-football-broncos-recap-chiefs-week-1","published_at":null,"retrieved_at":"2026-09-15T06:48:00-04:00","quality":"MEDIUM"}],"confidence_tier":"MEDIUM","fantasy_impact":{"direction":"UP","magnitude":"MEDIUM","time_horizon":"REST_OF_SEASON","uncertainty":"MEDIUM","role_fragility":"LOW","affected_entities":["Evan Engram"]},"model_treatment":"PARTIAL_UPDATE","next_required_evidence":["Week 2 route rate","Target rate"],"recheck_after":"2026-09-20T20:00:00-04:00","supersedes_event_id":null,"notes":[]},{"event_id":"sie-2026-w01-denver-playcalling-regime","schema_version":"season-intelligence-event.v1","season":2026,"week":1,"occurred_at":null,"known_at":"2026-09-15T06:48:00-04:00","subject":{"entity_type":"team","display_name":"Denver offense","team":"DEN","canonical_id":null},"event_type":"scheme","fact_status":"OBSERVED","summary":"Denver produced only 176 yards in Davis Webb's first regular-season play-calling game; Sean Payton publicly criticized the pass/run balance.","mechanisms":["coaching","volume"],"sources":[{"source_name":"Yahoo Sports","source_role":"primary_media","url":"https://nz.news.yahoo.com/sean-payton-on-broncos-play-calling-in-davis-webbs-debut-lotta-throws-not-enough-runs-035243729.html","published_at":null,"retrieved_at":"2026-09-15T06:48:00-04:00","quality":"MEDIUM"}],"confidence_tier":"MEDIUM","fantasy_impact":{"direction":"DOWN","magnitude":"MEDIUM","time_horizon":"NEXT_WEEK","uncertainty":"HIGH","role_fragility":"NOT_APPLICABLE","affected_entities":["Bo Nix","DEN RBs","DEN pass catchers"]},"model_treatment":"WATCH_ONLY","next_required_evidence":["Week 2 early-down run/pass rates","Webb/Payton follow-up comments"],"recheck_after":"2026-09-20T20:00:00-04:00","supersedes_event_id":null,"notes":[]},{"event_id":"sie-2026-w01-mims-hip-in-game","schema_version":"season-intelligence-event.v1","season":2026,"week":1,"occurred_at":null,"known_at":"2026-09-15T06:48:00-04:00","subject":{"entity_type":"player","display_name":"Marvin Mims Jr.","team":"DEN","canonical_id":null},"event_type":"injury","fact_status":"CONFIRMED","summary":"Mims left the game with a hip injury and was listed questionable before returning to the sideline; availability remained unresolved at the freeze.","mechanisms":["availability"],"sources":[{"source_name":"Mile High Report","source_role":"primary_media","url":"https://www.milehighreport.com/denver-broncos-news/184948/marvin-mims-jr-exits-monday-night-football-matchup-versus-chiefs-due-to-hip-injury","published_at":null,"retrieved_at":"2026-09-15T06:48:00-04:00","quality":"MEDIUM"}],"confidence_tier":"MEDIUM","fantasy_impact":{"direction":"DOWN","magnitude":"MEDIUM","time_horizon":"NEXT_WEEK","uncertainty":"HIGH","role_fragility":"NOT_APPLICABLE","affected_entities":["Marvin Mims Jr.","Pat Bryant","Troy Franklin"]},"model_treatment":"WATCH_ONLY","next_required_evidence":["Tuesday/Wednesday injury update","Practice participation"],"recheck_after":"2026-09-16T12:00:00-04:00","supersedes_event_id":null,"notes":[]},{"event_id":"sie-2026-w01-delane-shoulder-in-game","schema_version":"season-intelligence-event.v1","season":2026,"week":1,"occurred_at":null,"known_at":"2026-09-15T06:48:00-04:00","subject":{"entity_type":"player","display_name":"Mansoor Delane","team":"KC","canonical_id":null},"event_type":"injury","fact_status":"CONFIRMED","summary":"Delane intercepted Bo Nix but later left with a shoulder injury and did not return.","mechanisms":["availability","defensive_matchup"],"sources":[{"source_name":"Reuters","source_role":"wire","url":"https://www.reuters.com/sports/nfl/kenneth-walker-iii-delivers-kc-masterpiece-chiefs-blast-broncos-31-10--flm-2026-09-15/","published_at":null,"retrieved_at":"2026-09-15T06:48:00-04:00","quality":"HIGH"}],"confidence_tier":"HIGH","fantasy_impact":{"direction":"DOWN","magnitude":"LOW","time_horizon":"NEXT_WEEK","uncertainty":"HIGH","role_fragility":"NOT_APPLICABLE","affected_entities":["Mansoor Delane","KC secondary"]},"model_treatment":"WATCH_ONLY","next_required_evidence":["Imaging result","Practice status"],"recheck_after":"2026-09-15T12:00:00-04:00","supersedes_event_id":null,"notes":[]}]
